[
  {
    "code": "NA",
    "name": "North America",
    "description": "USA, Canada, and northern Mexico market cluster",
    "insights": [
      {
        "points": [
          "Direct, benefit-oriented messaging resonates",
          "Casual tone and informal address acceptable in most contexts",
          "Aspirational optimism and personal achievement themes",
          "Fast-paced, attention-grabbing creative preferred"
        ],
        "heading": "Cultural values"
      },
      {
        "points": [
          "Highly fragmented media landscape across digital and traditional",
          "Short-form content (15s, 30s) dominates",
          "Regional diversity significant: Northeast formal, West Coast casual, South traditional"
        ],
        "heading": "Media environment"
      }
    ],
    "is_active": true
  },
  {
    "code": "LATAM",
    "name": "Latin America",
    "description": "Spanish and Portuguese-speaking Americas",
    "insights": [
      {
        "points": [
          "Family-oriented messaging resonates strongly ('familia' as central value)",
          "Warm, relationship-focused tone preferred over transactional",
          "Emotional storytelling and music/celebration cultural touchpoints",
          "Respect for tradition alongside aspirational modernity"
        ],
        "heading": "Cultural values"
      },
      {
        "points": [
          "Mexican Spanish differs from Argentine, Colombian, or Caribbean variants",
          "Brazil (Portuguese) requires separate creative from Spanish LATAM",
          "Socioeconomic diversity wide - avoid one-size-fits-all approaches"
        ],
        "heading": "Regional diversity"
      },
      {
        "heading": "Language segmentation",
        "points": [
          "Latin American Spanish differs from European Spanish in vocabulary, grammar, and pronoun usage. 'Ustedes' replaces 'vosotros' for plural address across Latin America.",
          "'Neutral' Latin American Spanish can work for broad regional campaigns but sounds generic. For emotional resonance, localize to specific markets.",
          "Major dialect groups: Mexican Spanish (largest market, 126M), Rioplatense (Argentina/Uruguay, distinct voseo usage), Andean (Peru/Ecuador/Bolivia), Caribbean (Cuba/Dominican Republic/Puerto Rico), Central American, Colombian.",
          "Vocabulary differences are significant: 'carro' vs 'coche' vs 'auto' (car), 'computadora' vs 'ordenador' (computer). Use market-appropriate terminology."
        ]
      },
      {
        "heading": "Cultural considerations by region",
        "points": [
          "Mexico: Largest Spanish-language market. Strong national identity, family orientation, regional cuisine traditions, telenovela and entertainment industry influence.",
          "Argentina/Uruguay: Distinct Rioplatense accent and vocabulary. European cultural influences, mate culture, football passion, tango heritage.",
          "Colombia: Growing advertising market, diverse regional cultures (Caribbean coast vs. Andean interior vs. Pacific), music culture (salsa, cumbia, reggaeton).",
          "Andean region: Indigenous cultural influences remain visible, distinct food traditions, altitude and geography shape lifestyle.",
          "Central America and Caribbean: Each country has distinct identity despite linguistic similarity. Do not homogenize."
        ]
      },
      {
        "heading": "Shared cultural values",
        "points": [
          "Family (familia) is central across Latin America. Multi-generational bonds, extended family connections, and familial loyalty resonate emotionally.",
          "Music and celebration are woven into daily life. Advertising that incorporates authentic musical elements connects culturally.",
          "Football (soccer) is cultural infrastructure across most of the region (except Caribbean baseball cultures). Partnership opportunities but authenticity is essential.",
          "Regional food traditions carry deep identity significance. Respect local cuisines rather than generic 'Latin' food imagery."
        ]
      },
      {
        "heading": "Practical recommendations",
        "points": [
          "For pan-Latin American campaigns, Mexican Spanish often serves as the base due to market size and media influence (Televisa, Netflix content).",
          "For single-market depth, invest in local adaptation with local voice talent, cultural references, and terminology.",
          "Telenovela conventions remain influential in advertising aesthetics, though contemporary content is diversifying visual language.",
          "Digital advertising is growing rapidly (Mexico +16% in 2023), with social media engagement high across the region."
        ]
      }
    ],
    "is_active": true
  },
  {
    "code": "EMEA",
    "name": "Europe, Middle East, and Africa",
    "description": "",
    "insights": [],
    "is_active": true
  },
  {
    "code": "APAC",
    "name": "Asia-Pacific",
    "description": "",
    "insights": [],
    "is_active": true
  },
  {
    "code": "EU",
    "name": "European Union",
    "description": "",
    "insights": [],
    "is_active": true
  },
  {
    "code": "NORDICS",
    "name": "Nordic Countries",
    "description": "Scandinavian countries: Sweden, Norway, Denmark, Finland, Iceland",
    "insights": [
      {
        "points": [
          "Egalitarianism and modesty (Jantelagen) - avoid bragging or superiority claims",
          "Nature and sustainability deeply valued across all Nordic countries",
          "High trust in institutions and preference for evidence-based messaging",
          "Quality and functionality emphasized over luxury or status",
          "Egalitarianism and Janteloven (tall poppy/modesty) culture mean boastful or flashy messaging falls flat. Understatement and authenticity are valued.",
          "Environmental sustainability is a mainstream expectation, not a differentiator. Greenwashing will be scrutinized.",
          "Work-life balance, outdoor activities, and connection to nature are shared cultural priorities.",
          "Design aesthetics favor minimalism, functionality, and clean visual language—Scandinavian design principles extend to advertising."
        ],
        "heading": "Cultural values"
      },
      {
        "points": [
          "Clean, minimalist design language resonates strongly",
          "Muted color palettes preferred over bright, saturated colors",
          "Functionality emphasized over decoration",
          "Simplicity and clarity valued in messaging"
        ],
        "heading": "Visual aesthetics"
      },
      {
        "heading": "Language segmentation",
        "points": [
          "Each market requires its own language: Swedish, Norwegian (Bokmål or Nynorsk), Danish, Finnish. Despite cultural similarities, languages are distinct.",
          "Swedish, Norwegian, and Danish have some mutual intelligibility but advertising should use the local language for authenticity.",
          "Finnish is completely unrelated to Scandinavian languages (Finno-Ugric origin). Finland requires separate Finnish-language content; Swedish is an official minority language.",
          "English proficiency is high across all markets, but local languages perform better for emotional resonance and trust-building."
        ]
      },
      {
        "heading": "Market differences",
        "points": [
          "Denmark often leads regional trends. What works there may arrive in Sweden and Norway in 2-3 years, Finland slightly later.",
          "Finland: Print and traditional media remain relatively stronger than other Nordic markets. Linear TV still reaches broad audiences.",
          "Sweden: Largest market with most developed digital advertising. Commercial-free paid TV has reduced traditional TV advertising reach.",
          "Norway: Strong public broadcasting tradition. High disposable income and premium positioning opportunities."
        ]
      },
      {
        "heading": "Regulatory framework",
        "points": [
          "All Nordic markets have strong consumer protection and self-regulatory advertising bodies.",
          "Children's advertising faces restrictions across the region, particularly in Sweden.",
          "GDPR applies throughout (EU members Sweden, Denmark, Finland; EEA member Norway). Privacy compliance is essential."
        ]
      }
    ],
    "is_active": true
  },
  {
    "code": "BENELUX",
    "name": "Benelux",
    "description": "",
    "insights": [],
    "is_active": true
  },
  {
    "code": "DACH",
    "name": "DACH Region",
    "description": "Germany, Austria, Switzerland (German-speaking)",
    "insights": [
      {
        "points": [
          "Precision, engineering excellence, and quality craftsmanship resonate",
          "Formal address (Sie) expected in most advertising contexts",
          "Factual accuracy and substantive claims valued over emotional appeals",
          "Privacy and data protection paramount concerns"
        ],
        "heading": "Cultural values"
      },
      {
        "points": [
          "German audiences value informative advertising with clear product benefits",
          "Austrian audiences appreciate warmth alongside quality",
          "Swiss audiences prioritize discretion, reliability, and understatement",
          "German audiences value precision, factual accuracy, and substantive claims. Advertising should be informative and deliver clear product benefits.",
          "Austrian audiences appreciate warmth and tradition alongside quality. Messaging can be slightly more relationship-oriented than in Germany.",
          "Swiss audiences prioritize discretion, reliability, and quality. Understatement is valued; avoid superlatives without substantiation."
        ],
        "heading": "Tone and register"
      },
      {
        "heading": "Language segmentation",
        "points": [